{
  "schema_version": 2,
  "entity": "style-brief",
  "asset_id": "builtin:style:中式书卷风",
  "name": "中式书卷风",
  "aliases": [
    "中式书卷风",
    "书卷",
    "卷轴",
    "手卷",
    "chinese scroll"
  ],
  "variant_of": null,
  "lifecycle": "draft",
  "source": {
    "origin": "legacy-migrated",
    "upstream": "references/styles/01_通用母版/中式载体/中式书卷风.md"
  },
  "taxonomy": {
    "families": [
      "中式载体"
    ],
    "industries": [],
    "scenarios": []
  },
  "visual_language": {
    "direction": "chinese handscroll carrier, paper sheet flanked by wooden roller rods with ink-wash ruled lines, quiet classical reading layout"
  },
  "bindings": {
    "modes_supported": [
      "light"
    ]
  },
  "adaptation_gaps": [
    "theme_not_extracted",
    "recommendation_features_not_extracted",
    "formality_from_family_prior"
  ],
  "content_review": {
    "reviewed": true,
    "disposition": "revise-candidate",
    "reviewer_note": "结构完整（负面约束+密度映射在案）：候选晋升，需 U3 语义审阅补主题绑定与特征后转 active",
    "evidence": {
      "hex_anchors": 8,
      "has_negative_constraints": true,
      "density_mapped": true,
      "gaps": [
        "theme_not_extracted",
        "recommendation_features_not_extracted",
        "recommendation_features_defaults_pending_u3"
      ]
    }
  },
  "legacy_payload": {
    "aliases": [
      "中式书卷风",
      "书卷",
      "卷轴",
      "手卷",
      "chinese scroll"
    ],
    "best_for": "模拟卷轴的边框和水墨质感,沉静典雅的阅读体验;适合古典文学/文化讲堂/诗词雅集",
    "visual_direction": "chinese handscroll carrier, paper sheet flanked by wooden roller rods with ink-wash ruled lines, quiet classical reading layout",
    "canvas": {
      "aspect_ratio": "16:9",
      "background": "#383028→#F7F3E9 (中式书卷风底)",
      "composition": "左右卷轴杆 + 中央纸面,上下留白,栏线古典排版",
      "density": "low-to-medium, 保持风格留白节奏"
    },
    "color_palette": {
      "primary": "#4A3C2B(卷面墨褐/标题锚)",
      "secondary": "#F7F3E9(书卷纸白)",
      "accent": "#D9534F(朱红钤印)",
      "neutral": "#383028(卷轴深褐)",
      "rule": "锚点 #4A3C2B, #F7F3E9, #D9534F, #383028;来源:LandPPT html_template CSS 实测 token;融合了古典书卷的雅致与现代排版的清晰。模拟卷轴的边框和水墨质感，营造出沉静、典雅的阅读体验。"
    },
    "typography": {
      "title": "标题用思源宋体大字,配 Georgia 衬线副题",
      "body": "正文思源宋体,栏线内排行",
      "labels": "标签用宋体小字,朱红点缀"
    },
    "layout_patterns": [
      "左右卷轴杆 + 中央纸面的横向卷轴构图",
      "标题区带下栏线,正文以栏线分隔",
      "强调点用朱红钤印小块",
      "引文用竖排或缩进古典块"
    ],
    "layout_usage_rule": "左右卷轴杆 + 中央纸面的横向卷轴构图",
    "visual_elements": {
      "allowed": "左右卷轴杆 + 中央纸面,上下留白,栏线古典排版",
      "avoid": "不要高饱和现代撞色;不要几何硬阴影卡片,保持纸面平整"
    },
    "rendering_constraints": [
      "不要高饱和现代撞色",
      "不要几何硬阴影卡片,保持纸面平整",
      "不要无衬线粗黑大标题",
      "色板锚点以 brief HEX 为准,不漂移;文案准确,不虚构标识"
    ],
    "negative_prompt": [
      "不要高饱和现代撞色",
      "不要几何硬阴影卡片,保持纸面平整",
      "不要无衬线粗黑大标题"
    ],
    "reference": "GitHub: LandPPT · template_examples/中式书卷风.json"
  },
  "recommendation_features": {
    "density": "low-medium",
    "audience_conservatism": "balanced",
    "formality": 0.5,
    "environments": [
      "desktop-review"
    ],
    "feature_defaults_basis": "family-prior (U3)：机械默认按家族语义先验替换，来源记录在案"
  },
  "constraints": {
    "negative": [
      "不要高饱和现代撞色",
      "不要几何硬阴影卡片,保持纸面平整",
      "不要无衬线粗黑大标题",
      "色板锚点以 brief HEX 为准,不漂移;文案准确,不虚构标识"
    ]
  }
}
