{
  "schema_version": 2,
  "entity": "style-brief",
  "asset_id": "builtin:style:梦幻星河风",
  "name": "梦幻星河风",
  "aliases": [
    "梦幻星河",
    "Gradient Cosmic",
    "星河",
    "烟火",
    "梦幻",
    "cosmic",
    "epic"
  ],
  "variant_of": null,
  "lifecycle": "draft",
  "source": {
    "origin": "legacy-migrated",
    "upstream": "references/styles/01_通用母版/夜空氛围/梦幻星河风.md"
  },
  "taxonomy": {
    "families": [
      "夜空氛围"
    ],
    "industries": [],
    "scenarios": []
  },
  "visual_language": {
    "direction": "cosmic gradient drama, deep indigo night with golden firework light, epic dreamlike high contrast"
  },
  "bindings": {
    "modes_supported": [
      "dark"
    ]
  },
  "adaptation_gaps": [
    "theme_not_extracted",
    "recommendation_features_not_extracted",
    "formality_from_family_prior"
  ],
  "content_review": {
    "reviewed": true,
    "disposition": "revise-candidate",
    "reviewer_note": "结构完整（负面约束+密度映射在案）：候选晋升，需 U3 语义审阅补主题绑定与特征后转 active",
    "evidence": {
      "hex_anchors": 11,
      "has_negative_constraints": true,
      "density_mapped": true,
      "gaps": [
        "theme_not_extracted",
        "recommendation_features_not_extracted",
        "recommendation_features_defaults_pending_u3"
      ]
    }
  },
  "legacy_payload": {
    "aliases": [
      "梦幻星河",
      "Gradient Cosmic",
      "星河",
      "烟火",
      "梦幻",
      "cosmic",
      "epic"
    ],
    "best_for": "深靛暗夜金橙，史诗梦幻强对比;适合影视音乐/艺术视觉/年度庆典",
    "visual_direction": "cosmic gradient drama, deep indigo night with golden firework light, epic dreamlike high contrast",
    "canvas": {
      "aspect_ratio": "16:9",
      "background": "#1A237E→#000000→#FF9800",
      "composition": "对角线或上下分界，深色与金色对比",
      "density": "low-to-medium, 保持风格留白节奏"
    },
    "color_palette": {
      "primary": "#1A237E(主色/标题锚)",
      "secondary": "#000000(辅助色)",
      "accent": "#FF9800(强调色)",
      "neutral": "#F5F5F5(文字与中性锚)",
      "rule": "锚点 #1A237E, #000000, #FF9800, #FFD700;主色：深靛蓝 `#1A237E`、暗夜黑 `#000000`、金橙 `#FF9800`"
    },
    "typography": {
      "title": "思源黑体 Light / Inter;标题用现代衬线或粗体无衬线，星白色或金渐变填充",
      "body": "正文用无衬线 Light，行高 1.8，星白色",
      "labels": "副标题用细体无衬线，金米色"
    },
    "layout_patterns": [
      "对角线或上下分界，深色与金色对比",
      "标题大字，可金色描边或渐变",
      "信息卡片用半透明深色底 + 金边",
      "留白处点缀星辰"
    ],
    "layout_usage_rule": "对角线或上下分界，深色与金色对比",
    "visual_elements": {
      "allowed": "对角线或上下分界，深色与金色对比",
      "avoid": "不要全亮无对比，必须有深色衬底;不要低饱和灰暗、不要办公室商务风;不要卡通可爱"
    },
    "rendering_constraints": [
      "不要全亮无对比，必须有深色衬底",
      "不要低饱和灰暗、不要办公室商务风",
      "不要卡通可爱",
      "色板锚点以 brief HEX 为准,不漂移;文案准确,不虚构标识"
    ],
    "negative_prompt": [
      "不要全亮无对比，必须有深色衬底",
      "不要低饱和灰暗、不要办公室商务风",
      "不要卡通可爱",
      "不要超过两种强调金，保持克制"
    ],
    "reference": "GitHub: arcsin1/oh-my-ppt · styles/gradient-cosmic"
  },
  "recommendation_features": {
    "density": "low-medium",
    "audience_conservatism": "balanced",
    "formality": 0.4,
    "environments": [
      "desktop-review"
    ],
    "feature_defaults_basis": "family-prior (U3)：机械默认按家族语义先验替换，来源记录在案"
  },
  "constraints": {
    "negative": [
      "不要全亮无对比，必须有深色衬底",
      "不要低饱和灰暗、不要办公室商务风",
      "不要卡通可爱",
      "色板锚点以 brief HEX 为准,不漂移;文案准确,不虚构标识"
    ]
  }
}
