{
  "schema_version": 2,
  "entity": "style-brief",
  "asset_id": "builtin:style:历史古风题材风",
  "name": "历史古风题材风",
  "aliases": [
    "古风题材风",
    "历史题材风",
    "朝代服饰风"
  ],
  "variant_of": null,
  "lifecycle": "draft",
  "source": {
    "origin": "legacy-migrated",
    "upstream": "references/styles/05_来源_awesome-gpt-image-2/借鉴新增/历史古风题材风.md"
  },
  "taxonomy": {
    "families": [
      "未分类"
    ],
    "industries": [],
    "scenarios": []
  },
  "visual_language": {
    "direction": "history classical themes, dynasty costume, scroll narrative, poetry visual, historical accuracy, cultural atmosphere, scroll/album/poster form, vermilion and muted gold"
  },
  "bindings": {
    "modes_supported": [
      "light"
    ]
  },
  "adaptation_gaps": [
    "theme_not_extracted",
    "recommendation_features_not_extracted",
    "formality_from_family_prior"
  ],
  "content_review": {
    "reviewed": true,
    "disposition": "revise-candidate",
    "reviewer_note": "结构完整（负面约束+密度映射在案）：候选晋升，需 U3 语义审阅补主题绑定与特征后转 active",
    "evidence": {
      "hex_anchors": 7,
      "has_negative_constraints": true,
      "density_mapped": true,
      "gaps": [
        "theme_not_extracted",
        "recommendation_features_not_extracted",
        "recommendation_features_defaults_pending_u3"
      ]
    }
  },
  "legacy_payload": {
    "aliases": [
      "古风题材风",
      "历史题材风",
      "朝代服饰风"
    ],
    "best_for": "古风题材、长卷、朝代服饰、诗词视觉和历史场景，需要指定朝代/服饰制度/器物并避免混搭",
    "visual_direction": "history classical themes, dynasty costume, scroll narrative, poetry visual, historical accuracy, cultural atmosphere, scroll/album/poster form, vermilion and muted gold",
    "canvas": {
      "aspect_ratio": "16:9",
      "background": "ancient paper #F5EFE3 / ink",
      "composition": "长卷/册页 + 文化气质 + 器物参考",
      "density": "medium, classical"
    },
    "color_palette": {
      "primary": "ancient paper #F5EFE3, ink black",
      "secondary": "vermilion #C73E3A, muted gold #C9A227",
      "accent": "one cinnabar accent #B03A2E",
      "neutral": "near-black #1F1B16, paper #F5EFE3, warm gray #9C9484",
      "rule": "古典;历史准确;避免朝代混搭"
    },
    "typography": {
      "title": "楷体 display（霞鹜文楷 LXGW WenKai）",
      "body": "宋体 classical body（思源宋体）",
      "labels": "dynasty/motif tags",
      "text_quality": "exact朝代/器物"
    },
    "layout_patterns": [
      "朝代服饰",
      "长卷叙事",
      "诗词视觉",
      "历史场景"
    ],
    "layout_usage_rule": "指定朝代、服饰制度、器物参考、版式和文化气质;明确长卷/册页/海报形式;需要历史准确时避免朝代混搭;约束随机现代物件。",
    "layout_blueprints": [
      {
        "name": "古风页",
        "sections": [
          {
            "position": "center",
            "count": 1,
            "labels": [
              "长卷/古风主视觉"
            ]
          },
          {
            "position": "bottom",
            "count": 1,
            "labels": [
              "题诗/标题"
            ]
          }
        ]
      }
    ],
    "visual_elements": {
      "allowed": "dynasty costume, scroll, poetry visual, classical motif, vermilion accent",
      "avoid": "朝代混搭, 随机现代物件"
    },
    "rendering_constraints": [
      "历史准确;朝代不混搭。",
      "长卷/册页形式。",
      "约束现代物件。"
    ],
    "reference": "awesome-gpt-image-2 · history-classical-themes"
  },
  "recommendation_features": {
    "density": "balanced",
    "audience_conservatism": "balanced",
    "formality": 0.5,
    "environments": [
      "desktop-review"
    ],
    "feature_defaults_basis": "family-prior (U3)：机械默认按家族语义先验替换，来源记录在案"
  },
  "constraints": {
    "negative": [
      "历史准确;朝代不混搭。",
      "长卷/册页形式。",
      "约束现代物件。"
    ]
  }
}
