{
  "schema_version": 2,
  "entity": "style-brief",
  "asset_id": "builtin:style:晴橙落日海风",
  "name": "晴橙落日海风",
  "aliases": [
    "晴橙落日海",
    "Sunset Bay",
    "落日海",
    "晴橙",
    "治愈",
    "海边",
    "夕阳"
  ],
  "variant_of": null,
  "lifecycle": "draft",
  "source": {
    "origin": "legacy-migrated",
    "upstream": "references/styles/01_通用母版/柔和治愈/晴橙落日海风.md"
  },
  "taxonomy": {
    "families": [
      "柔和治愈"
    ],
    "industries": [],
    "scenarios": []
  },
  "visual_language": {
    "direction": "sunny orange sunset-sea gradient, warm horizon glow with refreshing summer warmth"
  },
  "bindings": {
    "modes_supported": [
      "light"
    ]
  },
  "adaptation_gaps": [
    "theme_not_extracted",
    "recommendation_features_not_extracted",
    "formality_from_family_prior"
  ],
  "content_review": {
    "reviewed": true,
    "disposition": "revise-candidate",
    "reviewer_note": "结构完整（负面约束+密度映射在案）：候选晋升，需 U3 语义审阅补主题绑定与特征后转 active",
    "evidence": {
      "hex_anchors": 11,
      "has_negative_constraints": true,
      "density_mapped": true,
      "gaps": [
        "theme_not_extracted",
        "recommendation_features_not_extracted",
        "recommendation_features_defaults_pending_u3"
      ]
    }
  },
  "legacy_payload": {
    "aliases": [
      "晴橙落日海",
      "Sunset Bay",
      "落日海",
      "晴橙",
      "治愈",
      "海边",
      "夕阳"
    ],
    "best_for": "晴空蓝柔杏白落日橙的治愈渐变;适合旅游出行/疗愈冥想/教学科普",
    "visual_direction": "sunny orange sunset-sea gradient, warm horizon glow with refreshing summer warmth",
    "canvas": {
      "aspect_ratio": "16:9",
      "background": "以 primary/neutral 锚定",
      "composition": "留白克制，左右 / 上下留白 ≥30%",
      "density": "low-to-medium, 保持风格留白节奏"
    },
    "color_palette": {
      "primary": "#48C6F0(主色/标题锚)",
      "secondary": "#FFF0D6(辅助色)",
      "accent": "#FF8A3D(强调色)",
      "neutral": "#333333(文字与中性锚)",
      "rule": "锚点 #48C6F0, #FFF0D6, #FF8A3D, #333333;主色三件套：晴空蓝 #48C6F0、柔杏白 #FFF0D6、落日橙 #FF8A3D，做垂直渐变模拟自然场景"
    },
    "typography": {
      "title": "标题用无衬线粗体（思源黑体 Bold），简洁有力",
      "body": "正文用无衬线 Regular 保持清晰",
      "labels": "小字号同族,适度字距,克制用色"
    },
    "layout_patterns": [
      "留白克制，左右 / 上下留白 ≥30%",
      "色块标注 + 渐变背景组合，每页 1-2 个色块作焦点",
      "优先选用自然场景意象",
      "卡片用大圆角与半透明白底"
    ],
    "layout_usage_rule": "留白克制，左右 / 上下留白 ≥30%",
    "visual_elements": {
      "allowed": "留白克制，左右 / 上下留白 ≥30%",
      "avoid": "不要高饱和霓虹、深暗色;不要硬朗几何、锐角;不要密集数据表"
    },
    "rendering_constraints": [
      "不要高饱和霓虹、深暗色",
      "不要硬朗几何、锐角",
      "不要密集数据表",
      "色板锚点以 brief HEX 为准,不漂移;文案准确,不虚构标识"
    ],
    "negative_prompt": [
      "不要高饱和霓虹、深暗色",
      "不要硬朗几何、锐角",
      "不要密集数据表",
      "不要商务衬线粗体",
      "不要塞满画面"
    ],
    "reference": "GitHub: arcsin1/oh-my-ppt · styles/orange-sea"
  },
  "recommendation_features": {
    "density": "low-medium",
    "audience_conservatism": "expressive",
    "formality": 0.3,
    "environments": [
      "desktop-review"
    ],
    "feature_defaults_basis": "family-prior (U3)：机械默认按家族语义先验替换，来源记录在案"
  },
  "constraints": {
    "negative": [
      "不要高饱和霓虹、深暗色",
      "不要硬朗几何、锐角",
      "不要密集数据表",
      "色板锚点以 brief HEX 为准,不漂移;文案准确,不虚构标识"
    ]
  }
}
