{
  "schema_version": 2,
  "entity": "style-brief",
  "asset_id": "builtin:style:金融奢华风",
  "name": "金融奢华风",
  "aliases": [
    "投行风",
    "黑金商务风",
    "金融高端风"
  ],
  "variant_of": null,
  "lifecycle": "draft",
  "source": {
    "origin": "legacy-migrated",
    "upstream": "references/styles/01_通用母版/商务专业/金融奢华风.md"
  },
  "taxonomy": {
    "families": [
      "商务专业"
    ],
    "industries": [],
    "scenarios": []
  },
  "visual_language": {
    "direction": "prestige investment-bank aesthetic, charcoal and gold, elegant serif typography, centered balanced structure, subtle fade-only transitions, sophisticated authoritative premium tone, old-money institutional refinement"
  },
  "bindings": {
    "modes_supported": [
      "light"
    ]
  },
  "adaptation_gaps": [
    "density_free_text_unmapped",
    "theme_not_extracted",
    "recommendation_features_not_extracted",
    "formality_from_family_prior"
  ],
  "content_review": {
    "reviewed": true,
    "disposition": "draft",
    "reviewer_note": "部分完整（约束=True，密度映射=False，HEX 锚 7）：保持 draft，缺口已记录不猜值",
    "evidence": {
      "hex_anchors": 7,
      "has_negative_constraints": true,
      "density_mapped": false,
      "gaps": [
        "density_free_text_unmapped",
        "theme_not_extracted",
        "recommendation_features_not_extracted"
      ]
    }
  },
  "legacy_payload": {
    "aliases": [
      "投行风",
      "黑金商务风",
      "金融高端风"
    ],
    "best_for": "Goldman/Morgan 式权威投行报告与高净值叙事,强调专业、稀缺与信任",
    "visual_direction": "prestige investment-bank aesthetic, charcoal and gold, elegant serif typography, centered balanced structure, subtle fade-only transitions, sophisticated authoritative premium tone, old-money institutional refinement",
    "canvas": {
      "aspect_ratio": "16:9",
      "background": "white with occasional deep charcoal hero, generous margins",
      "composition": "centered classical composition, balanced typographic blocks",
      "density": "low on hero, medium on analysis"
    },
    "color_palette": {
      "primary": "charcoal #2C3E50 and white",
      "secondary": "slate #5B7A9D, warm gray #D1D5DB",
      "accent": "gold #D4AF37",
      "neutral": "near-black #111827, gray #6B7280, hairline #E5E7EB",
      "rule": "classic, restrained, premium; avoid neon, gradients, playful color"
    },
    "typography": {
      "title": "elegant serif (Garamond/Georgia feel), authoritative",
      "body": "clean serif or refined sans, balanced",
      "labels": "small caps, classic, understated",
      "text_quality": "accurate financial terms, precise figures, formal tone"
    },
    "layout_patterns": [
      "centered hero with classical balance",
      "investment thesis structure",
      "asset allocation narrative",
      "performance with disciplined charts"
    ],
    "layout_usage_rule": "Maintain an old-money institutional tone; classical balance and restraint over novelty.",
    "layout_blueprints": [
      {
        "name": "报告封面",
        "sections": [
          {
            "position": "top",
            "count": 1,
            "labels": [
              "报告标题与机构名"
            ]
          },
          {
            "position": "center",
            "count": 1,
            "labels": [
              "金色细线 + 主标题"
            ]
          },
          {
            "position": "bottom",
            "count": 1,
            "labels": [
              "日期 / 机密级标签"
            ]
          }
        ]
      },
      {
        "name": "投资框架页",
        "sections": [
          {
            "position": "top",
            "count": 1,
            "labels": [
              "框架标题"
            ]
          },
          {
            "position": "main",
            "count": 1,
            "labels": [
              "经典结构图"
            ]
          },
          {
            "position": "bottom",
            "count": 2,
            "labels": [
              "依据",
              "建议"
            ]
          }
        ]
      }
    ],
    "visual_elements": {
      "allowed": "thin gold rules, classical serif, subtle monogram, restrained charts, wide margins",
      "avoid": "neon, busy gradients, cartoon, excessive decoration, casual type"
    },
    "rendering_constraints": [
      "Feels like an institutional wealth/investment report, not a hype deck.",
      "Gold and charcoal only; white space is generous.",
      "Accurate figures and terms; no invented seals or institution logos."
    ],
    "reference": "GitHub: 金融奢华风 · 白金高级感咨询工具包"
  },
  "constraints": {
    "negative": [
      "Feels like an institutional wealth/investment report, not a hype deck.",
      "Gold and charcoal only; white space is generous.",
      "Accurate figures and terms; no invented seals or institution logos."
    ]
  },
  "recommendation_features": {
    "audience_conservatism": "reserved",
    "formality": 0.8,
    "density": null,
    "environments": [
      "desktop-review"
    ],
    "feature_defaults_basis": "family-prior (U3)"
  }
}
