{
  "schema_version": 2,
  "entity": "style-brief",
  "asset_id": "builtin:style:快消营销风",
  "name": "快消营销风",
  "aliases": [
    "快消风",
    "FMCG风",
    "消费品牌营销风"
  ],
  "variant_of": null,
  "lifecycle": "draft",
  "source": {
    "origin": "legacy-migrated",
    "upstream": "references/styles/02_行业内容域/消费时尚/快消营销风.md"
  },
  "taxonomy": {
    "families": [
      "消费营销"
    ],
    "industries": [],
    "scenarios": []
  },
  "visual_language": {
    "direction": "CPG marketing style, benefit-forward, vibrant appetite appeal, promotion momentum, clear consumer promise, conversion-driven punch"
  },
  "bindings": {
    "modes_supported": [
      "light"
    ]
  },
  "adaptation_gaps": [
    "theme_not_extracted",
    "recommendation_features_not_extracted",
    "formality_from_family_prior"
  ],
  "content_review": {
    "reviewed": true,
    "disposition": "revise-candidate",
    "reviewer_note": "结构完整（负面约束+密度映射在案）：候选晋升，需 U3 语义审阅补主题绑定与特征后转 active",
    "evidence": {
      "hex_anchors": 6,
      "has_negative_constraints": true,
      "density_mapped": true,
      "gaps": [
        "theme_not_extracted",
        "recommendation_features_not_extracted",
        "recommendation_features_defaults_pending_u3"
      ]
    }
  },
  "legacy_payload": {
    "aliases": [
      "快消风",
      "FMCG风",
      "消费品牌营销风"
    ],
    "best_for": "快消与市场营销,需要突出卖点、人群、即时转化的视觉",
    "visual_direction": "CPG marketing style, benefit-forward, vibrant appetite appeal, promotion momentum, clear consumer promise, conversion-driven punch",
    "canvas": {
      "aspect_ratio": "16:9",
      "background": "bright / appetite warm, high-energy",
      "composition": "benefit + promotion + urgency",
      "density": "medium, high-energy"
    },
    "color_palette": {
      "primary": "appetite orange #F97316 / vibrant, white",
      "secondary": "warm yellow #FBBF24, red accents #EF4444",
      "accent": "one bold accent #EF4444",
      "neutral": "near-black #1F2937, white, warm #F5EFE6",
      "rule": "vibrant, hungry, benefit-led; punchy"
    },
    "typography": {
      "title": "bold friendly sans (Nunito / 思源黑体 Heavy), big claims",
      "body": "short punchy body",
      "labels": "price/promo tags",
      "text_quality": "clear claims, no false promise"
    },
    "layout_patterns": [
      "benefit + product hero",
      "人群/痛点 punch",
      "促销/定价 banner",
      "social proof & action"
    ],
    "layout_usage_rule": "Benefit-first and conversion-punch; product + claims + CTA rhythm.",
    "layout_blueprints": [
      {
        "name": "商品页",
        "sections": [
          {
            "position": "center",
            "count": 1,
            "labels": [
              "产品 + 卖点"
            ]
          },
          {
            "position": "bottom",
            "count": 2,
            "labels": [
              "价格",
              "人群"
            ]
          }
        ]
      },
      {
        "name": "促销页",
        "sections": [
          {
            "position": "main",
            "count": 3,
            "labels": [
              "折扣",
              "理由",
              "限时"
            ]
          }
        ]
      }
    ],
    "visual_elements": {
      "allowed": "appetite imagery, promo banners, bold claims, incentive callouts",
      "avoid": "clutter, misleading claims, over-saturation, cartoon overload"
    },
    "rendering_constraints": [
      "Benefit-forward, conversion-punch.",
      "Product + claims + CTA; vibrant but not chaotic.",
      "Clear, truthful claims; no false promise."
    ],
    "reference": "GitHub: 快消营销 · 电商大促惯例"
  },
  "recommendation_features": {
    "density": "balanced",
    "audience_conservatism": "expressive",
    "formality": 0.4,
    "environments": [
      "desktop-review"
    ],
    "feature_defaults_basis": "family-prior (U3)：机械默认按家族语义先验替换，来源记录在案"
  },
  "constraints": {
    "negative": [
      "Benefit-forward, conversion-punch.",
      "Product + claims + CTA; vibrant but not chaotic.",
      "Clear, truthful claims; no false promise."
    ]
  }
}
