{
  "schema_version": 2,
  "entity": "style-brief",
  "asset_id": "builtin:style:项目复盘风",
  "name": "项目复盘风",
  "aliases": [],
  "variant_of": "培训课件风",
  "lifecycle": "draft",
  "source": {
    "origin": "legacy-migrated",
    "upstream": "references/styles/03_场景用途结构/教学分享/项目复盘风.md"
  },
  "taxonomy": {
    "families": [
      "未分类"
    ],
    "industries": [],
    "scenarios": []
  },
  "visual_language": {
    "direction": "retrospective style, structured what-went-well/failed, lesson-capture, improvement action, honest team reflection, organizational learning"
  },
  "bindings": {
    "modes_supported": [
      "light"
    ]
  },
  "adaptation_gaps": [
    "theme_not_extracted",
    "recommendation_features_not_extracted",
    "formality_from_family_prior"
  ],
  "content_review": {
    "reviewed": true,
    "disposition": "merged",
    "reviewer_note": "变体：并入主风格家族（variant_of 声明），不单独晋升",
    "evidence": {
      "hex_anchors": 7,
      "has_negative_constraints": true,
      "density_mapped": true,
      "gaps": [
        "theme_not_extracted",
        "recommendation_features_not_extracted",
        "recommendation_features_defaults_pending_u3"
      ]
    }
  },
  "legacy_payload": {
    "variant_of": "培训课件风",
    "best_for": "项目复盘,需要结构化复盘、经验沉淀、改进动作与沉淀组织资产",
    "visual_direction": "retrospective style, structured what-went-well/failed, lesson-capture, improvement action, honest team reflection, organizational learning",
    "canvas": {
      "aspect_ratio": "16:9",
      "background": "warm light ground, readable",
      "composition": "objective → lesson → practice → takeaway",
      "density": "medium, pedagogical"
    },
    "color_palette": {
      "primary": "friendly blue #3B82F6 / warm accent #F97316, white",
      "secondary": "soft pastel blocks #BFDBFE / #FDE68A",
      "accent": "one bright accent #FBBF24",
      "neutral": "near-black #1F2937, warm gray #9C9484, white",
      "rule": "friendly, clear, not childish"
    },
    "typography": {
      "title": "clear friendly sans (Nunito / 思源黑体)",
      "body": "readable explainer body",
      "labels": "step/example tags",
      "text_quality": "accurate, jargon-light"
    },
    "layout_patterns": [
      "goal & outcome",
      "what went well / wrong",
      "root cause",
      "improvement action"
    ],
    "layout_usage_rule": "Structured reflection and lessons; honest + actionable improvement.",
    "layout_blueprints": [
      {
        "name": "结果页",
        "sections": [
          {
            "position": "top",
            "count": 1,
            "labels": [
              "目标 vs 结果"
            ]
          }
        ]
      },
      {
        "name": "复盘页",
        "sections": [
          {
            "position": "left",
            "count": 1,
            "labels": [
              "亮点"
            ]
          },
          {
            "position": "right",
            "count": 2,
            "labels": [
              "不足",
              "改进"
            ]
          }
        ]
      }
    ],
    "visual_elements": {
      "allowed": "baseline vs reality, cause diagram, action pipeline, honest callouts",
      "avoid": "blame/cartoon, clutter, vague, blame framing"
    },
    "rendering_constraints": [
      "Structured, honest, actionable introspection.",
      "Outcome, cause, lessons, actions; no blame.",
      "Accurate; no invented metrics."
    ],
    "reference": "GitHub: 项目复盘 · 复盘惯例"
  },
  "recommendation_features": {
    "density": "balanced",
    "audience_conservatism": "balanced",
    "formality": 0.5,
    "environments": [
      "desktop-review"
    ],
    "feature_defaults_basis": "family-prior (U3)：机械默认按家族语义先验替换，来源记录在案"
  },
  "constraints": {
    "negative": [
      "Structured, honest, actionable introspection.",
      "Outcome, cause, lessons, actions; no blame.",
      "Accurate; no invented metrics."
    ]
  }
}
