{
  "schema_version": 2,
  "entity": "style-brief",
  "asset_id": "builtin:style:活页标签手册风",
  "name": "活页标签手册风",
  "aliases": [
    "活页手册风",
    "标签手册风",
    "笔记本标签风",
    "Notebook Tabs"
  ],
  "variant_of": null,
  "lifecycle": "draft",
  "source": {
    "origin": "legacy-migrated",
    "upstream": "references/styles/01_通用母版/设计流派/活页标签手册风.md"
  },
  "taxonomy": {
    "families": [
      "设计流派"
    ],
    "industries": [],
    "scenarios": []
  },
  "visual_language": {
    "direction": "editorial notebook-tabs style, cream paper card on dark desk ground, colorful index tabs on the right edge, binder holes on the left, tactile and organized, classic-modern type pairing"
  },
  "bindings": {
    "modes_supported": [
      "light"
    ]
  },
  "adaptation_gaps": [
    "theme_not_extracted",
    "recommendation_features_not_extracted",
    "formality_from_family_prior"
  ],
  "content_review": {
    "reviewed": true,
    "disposition": "revise-candidate",
    "reviewer_note": "结构完整（负面约束+密度映射在案）：候选晋升，需 U3 语义审阅补主题绑定与特征后转 active",
    "evidence": {
      "hex_anchors": 9,
      "has_negative_constraints": true,
      "density_mapped": true,
      "gaps": [
        "theme_not_extracted",
        "recommendation_features_not_extracted",
        "recommendation_features_defaults_pending_u3"
      ]
    }
  },
  "legacy_payload": {
    "aliases": [
      "活页手册风",
      "标签手册风",
      "笔记本标签风",
      "Notebook Tabs"
    ],
    "best_for": "手册与教程内容,需要活页本式的触感组织与跨章导航的编辑气质",
    "visual_direction": "editorial notebook-tabs style, cream paper card on dark desk ground, colorful index tabs on the right edge, binder holes on the left, tactile and organized, classic-modern type pairing",
    "canvas": {
      "aspect_ratio": "16:9",
      "background": "#2D2D2D 深灰外底,中央 #F8F6F1 纸卡承载内容,右侧彩色索引标签列",
      "composition": "纸卡内容区 + 右缘竖排章节标签 + 左缘装订孔装饰",
      "density": "medium, 手册式分区"
    },
    "color_palette": {
      "primary": "#2D2D2D(深灰外底)配 #F8F6F1(纸卡底)与 #1A1A1A(墨字锚)",
      "secondary": "索引标签组 #98D4BB(薄荷)/#C7B8EA(薰衣草)/#F4B8C5(樱粉)/#A8D8EA(天蓝)",
      "accent": "#E8A33D(琥珀高亮标记)",
      "neutral": "#6E6A63(暖灰注释)",
      "rule": "深灰外底 + 纸卡 + 四色索引标签只作章节语义;琥珀仅高亮"
    },
    "typography": {
      "title": "经典编辑衬线(Bodoni Moda/思源宋体)标题",
      "body": "DM Sans/思源黑体正文,层级清爽",
      "labels": "右侧标签竖排小字(思源黑体,尺寸随画幅收缩)"
    },
    "layout_patterns": [
      "手册封面:纸卡 + 书名 + 章节标签全露出",
      "章节页:当前标签放大 + 章内小节目录",
      "内容页:纸卡两栏 + 高亮条 + 装订孔位",
      "附录页:索引表 + 标签色图例"
    ],
    "layout_usage_rule": "纸卡为内容载体,标签列恒在右缘指示进度;每页一章语义",
    "visual_elements": {
      "allowed": "纸卡投影、装订孔、彩色索引标签、细规则线、高亮条",
      "avoid": "卡片过多、字号过小、花哨贴纸、过度阴影"
    },
    "rendering_constraints": [
      "纸卡比例保持真实纸张感,不拉伸",
      "标签色只作章节语义不装饰滥用",
      "标签文字必须可读,不截断变形"
    ],
    "negative_prompt": [
      "不要卡片过多或过度阴影",
      "不要贴纸化装饰滥用",
      "不要标签文字过小不可读"
    ],
    "reference": "GitHub: frontend-slides-editable · STYLE_PRESETS「Notebook Tabs」（MIT,C4 吸收）"
  },
  "recommendation_features": {
    "density": "balanced",
    "audience_conservatism": "balanced",
    "formality": 0.45,
    "environments": [
      "desktop-review"
    ],
    "feature_defaults_basis": "family-prior (U3)：机械默认按家族语义先验替换，来源记录在案"
  },
  "constraints": {
    "negative": [
      "纸卡比例保持真实纸张感,不拉伸",
      "标签色只作章节语义不装饰滥用",
      "标签文字必须可读,不截断变形"
    ]
  }
}
