{
  "schema_version": 2,
  "entity": "style-brief",
  "asset_id": "builtin:style:全幅极简演讲风",
  "name": "全幅极简演讲风",
  "aliases": [
    "Keynote 미니멀 풀블리드",
    "keynote minimal fullbleed",
    "한 장 한 메시지"
  ],
  "variant_of": null,
  "lifecycle": "draft",
  "source": {
    "origin": "legacy-migrated",
    "upstream": "references/styles/16_来源_slides-grab/韩式精密网格/全幅极简演讲风.md"
  },
  "taxonomy": {
    "families": [
      "精密网格"
    ],
    "industries": [],
    "scenarios": []
  },
  "visual_language": {
    "direction": "korean keynote minimalism, full-bleed single-color or photographic ground carrying one sentence per slide, oversized grotesk display, over two-thirds negative space, no boxes no borders no shadows"
  },
  "bindings": {
    "modes_supported": [
      "light"
    ]
  },
  "adaptation_gaps": [
    "theme_not_extracted",
    "recommendation_features_not_extracted",
    "formality_from_family_prior"
  ],
  "content_review": {
    "reviewed": true,
    "disposition": "revise-candidate",
    "reviewer_note": "结构完整（负面约束+密度映射在案）：候选晋升，需 U3 语义审阅补主题绑定与特征后转 active",
    "evidence": {
      "hex_anchors": 4,
      "has_negative_constraints": true,
      "density_mapped": true,
      "gaps": [
        "theme_not_extracted",
        "recommendation_features_not_extracted",
        "recommendation_features_defaults_pending_u3"
      ]
    }
  },
  "legacy_payload": {
    "aliases": [
      "Keynote 미니멀 풀블리드",
      "keynote minimal fullbleed",
      "한 장 한 메시지"
    ],
    "best_for": "Keynote 式一页一讯息的极端留白演讲;适合主题演讲/产品发布/品牌宣言",
    "visual_direction": "korean keynote minimalism, full-bleed single-color or photographic ground carrying one sentence per slide, oversized grotesk display, over two-thirds negative space, no boxes no borders no shadows",
    "canvas": {
      "aspect_ratio": "16:9",
      "background": "#FFFFFF、#000000(变体锚)",
      "composition": "一页一讯息:全幅图/纯色底上仅一句完整陈述,文字占画面 ≤1/3",
      "density": "medium, 密而不挤"
    },
    "color_palette": {
      "primary": "#FFFFFF(纯白底)",
      "secondary": "#000000(整页纯黑变体)",
      "accent": "#0071E3(唯一产品蓝)",
      "neutral": "#86868B(次要灰字)"
    },
    "typography": {
      "title": "Helvetica Neue 700(54pt 级,黑或白)",
      "body": "Helvetica Neue 400,leading 1.2",
      "labels": "Helvetica Neue 400 小字,灰 #86868B"
    },
    "layout_patterns": [
      "全幅影像或纯色底 + 一句完整陈述",
      "文字面积 ≤1/3,其余留白或全幅图",
      "无项目符号——多项内容一律拆页",
      "纯白页与纯黑页交替构成节奏"
    ],
    "layout_usage_rule": "全幅影像或纯色底 + 一句完整陈述",
    "visual_elements": {
      "allowed": "一页一讯息:全幅图/纯色底上仅一句完整陈述,文字占画面 ≤1/3",
      "avoid": "不要项目符号列表——多项即拆页; 不要用文字填满版面,文本超 1/3 即失败"
    },
    "rendering_constraints": [
      "不要项目符号列表——多项即拆页",
      "不要用文字填满版面,文本超 1/3 即失败",
      "不要盒子/卡片/边框/阴影/圆角",
      "色板锚点以 brief HEX 为准,不漂移;文案准确,不虚构标识"
    ],
    "negative_prompt": [
      "不要项目符号列表——多项即拆页",
      "不要用文字填满版面,文本超 1/3 即失败",
      "不要盒子/卡片/边框/阴影/圆角"
    ],
    "paired_illustration": {
      "family": "photographic",
      "density": "core"
    },
    "reference": "GitHub: epoko77-ai/design-diversity(via slides-grab design-diversity-data.js,MIT,快照 2026-05-24)· DD02 Keynote 미니멀 풀블리드"
  },
  "recommendation_features": {
    "density": "balanced",
    "audience_conservatism": "balanced",
    "formality": 0.7,
    "environments": [
      "desktop-review"
    ],
    "feature_defaults_basis": "family-prior (U3)：机械默认按家族语义先验替换，来源记录在案"
  },
  "constraints": {
    "negative": [
      "不要项目符号列表——多项即拆页",
      "不要用文字填满版面,文本超 1/3 即失败",
      "不要盒子/卡片/边框/阴影/圆角",
      "色板锚点以 brief HEX 为准,不漂移;文案准确,不虚构标识"
    ]
  }
}
